category	hgnc_id	hgnc_symbol	uniprot_acc	ensembl_gene	ncbi_gene_id	uniprot_flag	go_flag	hpa_flag	surfy_flag	cspa_flag	n_db_votes	sonnet_full_flag	adc_source	therapeutic	adc_antigen	target_function	viral_agent	viral_protein	viral_entry_mode
ADC	HGNC:10256	ROR1	Q01973	ENSG00000185483	4919	1	0	0	1	1	3	1	ADCdb		Inactive tyrosine-protein kinase transmembrane receptor ROR1 (ROR1)	Has very low kinase activity in vitro and is unlikely to function as a tyrosine kinase in vivo. Receptor for ligand WNT5A which activate downstream NFkB signaling pathway and may result in the inhibition of WNT3A-mediated signaling. In inner ear, crucial for spiral ganglion neurons to innervate auditory hair cells.			
ADC	HGNC:10257	ROR2	Q01974	ENSG00000169071	4920	1	0	0	1	1	3	1	ADCdb		Tyrosine-protein kinase transmembrane receptor ROR2 (ROR2)	Tyrosine-protein kinase receptor which may be involved in the early formation of the chondrocytes. It seems to be required for cartilage and growth plate development. Phosphorylates YWHAB, leading to induction of osteogenesis and bone formation. In contrast, has also been shown to have very little tyrosine kinase activity in vitro. May act as a receptor for wnt ligand WNT5A which may result in the inhibition of WNT3A-mediated signaling.			
ADC	HGNC:1060	CXCR5	P32302	ENSG00000160683	643	1	1	0	1	1	4	1	ADCdb		C-X-C chemokine receptor type 5 (CXCR5)	Cytokine receptor that binds to B-lymphocyte chemoattractant (BLC). Involved in B-cell migration into B-cell follicles of spleen and Peyer patches but not into those of mesenteric or peripheral lymph nodes. May have a regulatory function in Burkitt lymphoma (BL) lymphomagenesis and/or B-cell differentiation.			
ADC	HGNC:10658	SDC1	P18827	ENSG00000115884	6382	1	1	0	1	0	3	1	TheraSAbDab	Indatuximab; INDATUXIMAB RAVTANSINE	Syndecan-1 (SDC1); Syndecan-1 (SDC1); Integrin alpha-4 (ITGA4)	Cell surface proteoglycan that bears both heparan sulfate and chondroitin sulfate and that links the cytoskeleton to the interstitial matrix. Regulates exosome biogenesis in concert with SDCBP and PDCD6IP.			
ADC	HGNC:10729	SEMA4A	Q9H3S1	ENSG00000196189	64218	1	0	0	1	1	3	1	ADCdb		Semaphorin-4A (SEMA4A)	Cell surface receptor for PLXNB1, PLXNB2, PLXNB3 and PLXND1 that plays an important role in cell-cell signaling. Regulates glutamatergic and GABAergic synapse development. Promotes the development of inhibitory synapses in a PLXNB1-dependent manner and promotes the development of excitatory synapses in a PLXNB2-dependent manner. Plays a role in priming antigen-specific T-cells, promotes differentiation of Th1 T- helper cells, and thereby contributes to adaptive immunity. Promotes phosphorylation of TIMD2. Inhibits angiogenesis. Promotes axon growth cone collapse. Inhibits axonal extension by providing local signals to specify territories inaccessible for growing axons.			
ADC	HGNC:10943	SLC1A5	Q15758	ENSG00000105281	6510	1	1	1	1	0	4	1	ADCdb		Neutral amino acid transporter B(0) (SLC1A5)	Sodium-coupled antiporter of neutral amino acids. In a tri-substrate transport cycle, exchanges neutral amino acids between the extracellular and intracellular compartments, coupled to the inward cotransport of at least one sodium ion. The preferred substrate is the essential amino acid L-glutamine, a precursor for biosynthesis of proteins, nucleotides and amine sugars as well as an alternative fuel for mitochondrial oxidative phosphorylation. Exchanges L-glutamine with other neutral amino acids such as L-serine, L-threonine and L-asparagine in a bidirectional way. Provides L-glutamine to proliferating stem and activated cells driving the metabolic switch toward cell differentiation. The transport cycle is usually pH-independent, with the exception of L-glutamate. Transports extracellular L-glutamate coupled to the cotransport of one proton and one sodium ion in exchange for intracellular L-glutamine counter-ion. May provide for L-glutamate uptake in glial cells regulating glutamine/glutamate cycle in the nervous system. Can transport D-amino acids. Mediates D-serine release from the retinal glia potentially affecting NMDA receptor function in retinal neurons. Displays sodium- and amino acid-dependent but uncoupled channel-like anion conductance with a preference SCN- &gt;&gt; NO3- &gt; I- &gt; Cl-. Through binding of the fusogenic protein syncytin-1/ERVW-1 may mediate trophoblasts syncytialization, the spontaneous fusion of their plasma membranes, an essential process in placental development.			
ADC	HGNC:11020	SLC34A2	O95436	ENSG00000157765	10568	1	1	1	1	0	4	1	TheraSAbDab	Lifastuzumab; LIFASTUZUMAB VEDOTIN	Sodium-dependent phosphate transport protein 2B (SLC34A2)	Involved in actively transporting phosphate into cells via Na(+) cotransport.			
ADC	HGNC:11026	SLC3A2	P08195	ENSG00000168003	6520	1	1	1	1	1	5	1	ADCdb		4F2 cell-surface antigen heavy chain (SLC3A2)	Component of several heterodimeric complexes involved in amino acid transport. The precise substrate specificity depends on the other subunit in the heterodimer. The complexes function as amino acid exchangers. The heterodimer functions as sodium-independent, high-affinity transporter that mediates uptake of large neutral amino acids such as phenylalanine, tyrosine, leucine, histidine, methionine, tryptophan, valine and isoleucine. The heterodimer with SLC7A5/LAT1 mediates the uptake of L-DOPA. The heterodimer formed by SLC3A2 and SLC7A6 or SLC3A2 and SLC7A7 mediates the uptake of dibasic amino acids. The heterodimer with SLC7A5/LAT1 mediates the transport of thyroid hormones diiodothyronine (T2), triiodothyronine (T3) and thyroxine (T4) across the cell membrane. The heterodimer with SLC7A5/LAT1 is involved in the uptake of toxic methylmercury (MeHg) when administered as the L-cysteine or D,L-homocysteine complexes. When associated with LAPTM4B, the heterodimer with SLC7A5/LAT1 is recruited to lysosomes to promote leucine uptake into these organelles, and thereby mediates mTORC1 activation. The heterodimer with SLC7A5/LAT1 may play a role in the transport of L-DOPA across the blood-brain barrier. The heterodimer formed by SLC3A2 and SLC7A5/LAT1 or SLC3A2 and SLC7A8/LAT2 is involved in the cellular activity of small molecular weight nitrosothiols, via the stereoselective transport of L- nitrosocysteine (L-CNSO) across the transmembrane. The heterodimer with SLC7A10 translocates small neutral L- and D-amino acids across the plasma membrane. SLC3A2-SLC7A10 preferentially mediates exchange transport, but can also operate via facilitated diffusion. Together with ICAM1, regulates the transport activity of SLC7A8/LAT2 in polarized intestinal cells by generating and delivering intracellular signals. Required for .geting of SLC7A5/LAT1 and SLC7A8/LAT2 to the plasma membrane and for channel activity. Plays a role in nitric oxide synthesis in human umbilical vein endothelial cells (HUVECs) via transport of L-arginine. May mediate blood-to-retina L-leucine transport across the inner blood-retinal barrier.			
ADC	HGNC:11059	SLC7A11	Q9UPY5	ENSG00000151012	23657	1	1	0	0	0	2	1	ADCdb		Cystine/glutamate transporter (SLC7A11)	Heterodimer with SLC3A2, that functions as an antiporter by mediating the exchange of extracellular anionic L-cystine and intracellular L-glutamate across the cellular plasma membrane. Provides L-cystine for the maintenance of the redox balance between extracellular L- cystine and L-cysteine and for the maintenance of the intracellular levels of glutathione that is essential for cells protection from oxidative stress. The transport is sodium-independent, electroneutral with a stoichiometry of 1:1, and is drove by the high intracellular concentration of L-glutamate and the intracellular reduction of L-cystine. In addition, mediates the import of L-kynurenine leading to anti-ferroptotic signaling propagation required to maintain L-cystine and glutathione homeostasis. Moreover, mediates N-acetyl-L-cysteine uptake into the placenta leading to subsequently down-regulation of pathways associated with oxidative stress, inflammation and apoptosis. In vitro can also transport L-aspartate. May participate in astrocyte and meningeal cell proliferation during development and can provide neuroprotection by promoting glutathione synthesis and delivery from non-neuronal cells such as astrocytes and meningeal cells to immature neurons. Controls the production of pheomelanin pigment directly.			
ADC	HGNC:1116	BSG	P35613	ENSG00000172270	682	1	0	0	1	1	3	1	ADCdb		Basigin (BSG)	Essential for normal retinal maturation and development. Acts as a retinal cell surface receptor for NXNL1 and plays an important role in NXNL1-mediated survival of retinal cone photoreceptors. In association with glucose transporter SLC16A1/GLUT1 and NXNL1, promotes retinal cone survival by enhancing aerobic glycolysis and accelerating the entry of glucose into photoreceptors. May act as a potent stimulator of IL6 secretion in multiple cell lines that include monocytes.			
ADC	HGNC:11331	SSTR2	P30874	ENSG00000180616	6752	1	0	0	1	0	2	1	ADCdb		Somatostatin receptor type 2 (SSTR2)	Receptor for somatostatin-14 and -28. This receptor is coupled via pertussis toxin sensitive G proteins to inhibition of adenylyl cyclase. In addition it stimulates phosphotyrosine phosphatase and PLC via pertussis toxin insensitive as well as sensitive G proteins. Inhibits calcium entry by suppressing voltage-dependent calcium channels. Acts as the functionally dominant somatostatin receptor in pancreatic alpha- and beta-cells where it mediates the inhibitory effect of somatostatin-14 on hormone secretion. Inhibits cell growth through enhancement of MAPK1 and MAPK2 phosphorylation and subsequent up-regulation of CDKN1B. Stimulates neuronal migration and axon outgrowth and may participate in neuron development and maturation during brain development. Mediates negative regulation of insulin receptor signaling through PTPN6. Inactivates SSTR3 receptor function following heterodimerization.			
ADC	HGNC:11344	ST14	Q9Y5Y6	ENSG00000149418	6768	1	0	0	0	0	1	1	ADCdb		Suppressor of tumorigenicity 14 protein (ST14)	Degrades extracellular matrix. Proposed to play a role in breast cancer invasion and metastasis. Exhibits trypsin-like activity as defined by cleavage of synthetic substrates with Arg or Lys as the P1 site. Involved in the terminal differentiation of keratinocytes through prostasin (PRSS8) activation and filaggrin (FLG) processing.			
ADC	HGNC:11378	STEAP1	Q9UHE8	ENSG00000164647	26872	1	0	0	0	0	1	1	TheraSAbDab	Vandortuzumab; VANDORTUZUMAB VEDOTIN	Metalloreductase STEAP1 (STEAP1)	Metalloreductase that has the ability to reduce both Fe(3+) to Fe(2+) and Cu(2+) to Cu(1+). Uses NAD(+) as acceptor.			
ADC	HGNC:11529	EPCAM	P16422	ENSG00000119888	4072	1	1	1	1	1	5	1	TheraSAbDab	Oportuzumab; OPORTUZUMAB MONATOX; TUCOTUZUMAB CELMOLEUKIN; CITATUZUMAB BOGATOX	Epithelial cell adhesion molecule (EPCAM)	May act as a physical homophilic interaction molecule between intestinal epithelial cells (IECs) and intraepithelial lymphocytes (IELs) at the mucosal epithelium for providing immunological barrier as a first line of defense against mucosal infection. Plays a role in embryonic stem cells proliferation and differentiation. Up-regulates the expression of FABP5, MYC and cyclins A and E.			
ADC	HGNC:11530	TACSTD2	P09758	ENSG00000184292	4070	1	1	1	1	1	5	1	TheraSAbDab	Datopotamab; Sacituzumab; Tizetatug; SACITUZUMAB GOVITECAN; DATOPOTAMAB DERUXTECAN	Tumor-associated calcium signal transducer 2 (TACSTD2); Inactive tyrosine-protein kinase 7 (PTK7)				
ADC	HGNC:11763	TFRC	P02786	ENSG00000072274	7037	1	1	0	0	1	3	1	TheraSAbDab	Delpacibart	Transferrin receptor protein 1 (TFRC)	Cellular uptake of iron occurs via receptor-mediated endocytosis of ligand-occupied transferrin receptor into specialized endosomes. Endosomal acidification leads to iron release. The apotransferrin-receptor complex is then recycled to the cell surface with a return to neutral pH and the concomitant loss of affinity of apotransferrin for its receptor. Transferrin receptor is necessary for development of erythrocytes and the nervous system. A second ligand, the hedi.y hemochromatosis protein HFE, competes for binding with transferrin for an overlapping C-terminal binding site. Positively regulates T and B cell proliferation through iron uptake. Acts as a lipid sensor that regulates mitochondrial fusion by regulating activation of the JNK pathway. When die.y levels of stearate (C18:0) are low, promotes activation of the JNK pathway, resulting in HUWE1-mediated ubiquitination and subsequent degradation of the mitofusin MFN2 and inhibition of mitochondrial fusion. When die.y levels of stearate (C18:0) are high, TFRC stearoylation inhibits activation of the JNK pathway and thus degradation of the mitofusin MFN2.			
ADC	HGNC:11766	TGFB1	P01137	ENSG00000105329	7040	0	1	1	0	1	3	1	ADCdb		Transforming growth factor beta-1 proprotein (TGFB1)	Transforming growth factor beta-1 proprotein: Precursor of the Latency-associated peptide (LAP) and Transforming growth factor beta-1 (TGF-beta-1) chains, which constitute the regulatory and active subunit of TGF-beta-1, respectively.			
ADC	HGNC:11772	TGFBR1	P36897	ENSG00000106799	7046	1	1	1	1	0	4	1	ADCdb		TGF-beta receptor type-1 (TGFBR1)	Transmembrane serine/threonine kinase forming with the TGF- beta type II serine/threonine kinase receptor, TGFBR2, the non- promiscuous receptor for the TGF-beta cytokines TGFB1, TGFB2 and TGFB3. Transduces the TGFB1, TGFB2 and TGFB3 signal from the cell surface to the cytoplasm and is thus regulating a plethora of physiological and pathological processes including cell cycle arrest in epithelial and hematopoietic cells, control of mesenchymal cell proliferation and differentiation, wound healing, extracellular matrix production, immunosuppression and carcinogenesis. The formation of the receptor complex composed of 2 TGFBR1 and 2 TGFBR2 molecules symmetrically bound to the cytokine dimer results in the phosphorylation and the activation of TGFBR1 by the constitutively active TGFBR2. Activated TGFBR1 phosphorylates SMAD2 which dissociates from the receptor and interacts with SMAD4. The SMAD2-SMAD4 complex is subsequently translocated to the nucleus where it modulates the transcription of the TGF-beta-regulated genes. This constitutes the canonical SMAD-dependent TGF-beta signaling cascade. Also involved in non-canonical, SMAD-independent TGF-beta signaling pathways. For instance, TGFBR1 induces TRAF6 autoubiquitination which in turn results in MAP3K7 ubiquitination and activation to trigger apoptosis. Also regulates epithelial to mesenchymal transition through a SMAD-independent signaling pathway through PARD6A phosphorylation and activation.			
ADC	HGNC:11853	TM4SF1	P30408	ENSG00000169908	4071	1	0	0	1	0	2	1	ADCdb		Transmembrane 4 L6 family member 1 (TM4SF1)				
ADC	HGNC:11867	TMEFF2	Q9UIK5	ENSG00000144339	23671	1	0	0	1	0	2	1	ADCdb		Tomoregulin-2 (TMEFF2)	May be a survival factor for hippocampal and mesencephalic neurons. The shedded form up-regulates cancer cell proliferation, probably by promoting ERK1/2 phosphorylation.			
ADC	HGNC:11892	TNF	P01375	ENSG00000232810	7124	1	1	0	0	0	2	1	ADCdb		Tumor necrosis factor (TNF)	Cytokine that binds to TNFRSF1A/TNFR1 and TNFRSF1B/TNFBR. It is mainly secreted by macrophages and can induce cell death of certain tumor cell lines. It is potent pyrogen causing fever by direct action or by stimulation of interleukin-1 secretion and is implicated in the induction of cachexia, Under certain conditions it can stimulate cell proliferation and induce cell differentiation. Impairs regulatory T- cells (Treg) function in individuals with rheumatoid arthritis via FOXP3 dephosphorylation. Up-regulates the expression of protein phosphatase 1 (PP1), which dephosphorylates the key &#039;Ser-418&#039; residue of FOXP3, thereby inactivating FOXP3 and rendering Treg cells functionally defective. Key mediator of cell death in the anticancer action of BCG-stimulated neutrophils in combination with DIABLO/SMAC mimetic in the RT4v6 bladder cancer cell line. Induces insulin resistance in adipocytes via inhibition of insulin-induced IRS1 tyrosine phosphorylation and insulin-induced glucose uptake. Induces GKAP42 protein degradation in adipocytes which is partially responsible for TNF-induced insulin resistance. Plays a role in angiogenesis by inducing VEGF production synergistically with IL1B and IL6.			
ADC	HGNC:11905	TNFRSF10B	O14763	ENSG00000120889	8795	1	1	0	0	0	2	1	ADCdb		Tumor necrosis factor receptor superfamily member 10B (TNFRSF10B)	Receptor for the cytotoxic ligand TNFSF10/TRAIL. The adapter molecule FADD recruits caspase-8 to the activated receptor. The resulting death-inducing signaling complex (DISC) performs caspase-8 proteolytic activation which initiates the subsequent cascade of caspases (aspartate-specific cysteine proteases) mediating apoptosis. Promotes the activation of NF-kappa-B. Essential for ER stress-induced apoptosis.			
ADC	HGNC:11913	TNFRSF17	Q02223	ENSG00000048462	608	1	0	0	1	1	3	1	TheraSAbDab	Belantamab; Pamlectabart; BELANTAMAB MAFODOTIN	Tumor necrosis factor receptor superfamily member 17 (TNFRSF17)	Receptor for TNFSF13B/BLyS/BAFF and TNFSF13/APRIL. Promotes B-cell survival and plays a role in the regulation of humoral immunity. Activates NF-kappa-B and JNK.			
ADC	HGNC:11916	TNFRSF1A	P19438	ENSG00000067182	7132	1	1	0	1	1	4	1	ADCdb		Tumor necrosis factor receptor superfamily member 1A (TNFRSF1A)	Receptor for TNFSF2/TNF-alpha and homotrimeric TNFSF1/lymphotoxin-alpha. The adapter molecule FADD recruits caspase-8 to the activated receptor. The resulting death-inducing signaling complex (DISC) performs caspase-8 proteolytic activation which initiates the subsequent cascade of caspases (aspartate-specific cysteine proteases) mediating apoptosis. Contributes to the induction of non-cytocidal TNF effects including anti-viral state and activation of the acid sphingomyelinase.			
ADC	HGNC:11917	TNFRSF1B	P20333	ENSG00000028137	7133	1	0	0	1	0	2	1	ADCdb		TNF receptor superfamily member 1B (TNFRSF1B)	Receptor with high affinity for TNFSF2/TNF-alpha and; approximately 5-fold lower affinity for homotrimeric; TNFSF1/lymphotoxin-alpha. The TRAF1/TRAF2 complex recruits the; apoptotic suppressors BIRC2 and BIRC3 to TNFRSF1B/TNFR2. This receptor; mediates most of the metabolic effects of TNF-alpha. Isoform 2 blocks; TNF-alpha-induced apoptosis, which suggests that it regulates TNF-alpha; function by antagonizing its biological activity.			
ADC	HGNC:11919	CD40	P25942	ENSG00000101017	958	1	1	1	1	1	5	1	ADCdb		Tumor necrosis factor receptor superfamily member 5 (CD40)	Receptor for TNFSF5/CD40LG. Transduces TRAF6- and MAP3K8-mediated signals that activate ERK in macrophages and B cells, leading to induction of immunoglobulin secretion.			
ADC	HGNC:11923	TNFRSF8	P28908	ENSG00000120949	943	1	0	1	1	1	4	1	TheraSAbDab	Brentuximab; BRENTUXIMAB VEDOTIN	Tumor necrosis factor receptor superfamily member 8 (TNFRSF8)	Receptor for TNFSF8/CD30L. May play a role in the regulation of cellular growth and transformation of activated lymphoblasts. Regulates gene expression through activation of NF-kappa- B.			
ADC	HGNC:11925	TNFSF10	P50591	ENSG00000121858	8743	1	0	0	0	0	1	1	ADCdb		Tumor necrosis factor ligand superfamily member 10 (TNFSF10)	Cytokine that binds to TNFRSF10A/TRAILR1, TNFRSF10B/TRAILR2, TNFRSF10C/TRAILR3, TNFRSF10D/TRAILR4 and possibly also to TNFRSF11B/OPG. Induces apoptosis. Its activity may be modulated by binding to the decoy receptors TNFRSF10C/TRAILR3, TNFRSF10D/TRAILR4 and TNFRSF11B/OPG that cannot induce apoptosis.			
ADC	HGNC:11937	CD70	P32970	ENSG00000125726	970	1	0	0	1	0	2	1	TheraSAbDab	Vorsetuzumab; VORSETUZUMAB MAFODOTIN	CD70 antigen (CD70)	Cytokine which is the ligand for CD27. The CD70-CD27 pathway plays an important role in the generation and maintenance of T cell immunity, in particular during antiviral responses. Upon CD27 binding, induces the proliferation of costimulated T-cells and enhances the generation of cytolytic T-cells.			
ADC	HGNC:12004	TPBG	Q13641	ENSG00000146242	7162	1	1	0	1	1	4	1	ADCdb	ANATUMOMAB MAFENATOX; NAPTUMOMAB ESTAFENATOX	Trophoblast glycoprotein (TPBG); Trophoblast glycoprotein (TPBG); Hepatocyte growth factor receptor (MET)	May function as an inhibitor of Wnt/beta-catenin signaling by indirectly interacting with LRP6 and blocking Wnt3a-dependent LRP6 internalization.			
ADC	HGNC:13258	CLEC4C	Q8WTT0	ENSG00000198178	170482	1	1	0	0	0	2	1	ADCdb		C-type lectin domain family 4 member C (CLEC4C)	Lectin-type cell surface receptor which may play a role in antigen capturing by dendritic cells. Specifically recognizes non-sialylated galactose- terminated biantennary glycans containing the trisaccharide epitope Gal(beta1-3/4)GlcNAc(beta1-2)Man. Binds to serum IgG. Efficiently .gets ligand into antigen-processing and peptide-loading compartments for presentation to T-cells. May mediate potent inhibition of induction of IFN-alpha/beta expression in plasmacytoid dendritic cells. May act as a signaling receptor that activates protein-tyrosine kinases and mobilizes intracellular calcium.			
ADC	HGNC:13299	LGR4	Q9BXB1	ENSG00000205213	55366	1	0	0	1	0	2	1	ADCdb		Leucine-rich repeat-containing G-protein coupled receptor 4 (LGR4)	Receptor for R-spondins that potentiates the canonical Wnt signaling pathway and is involved in the formation of various organs. Upon binding to R-spondins (RSPO1, RSPO2, RSPO3 or RSPO4), associates with phosphorylated LRP6 and frizzled receptors that are activated by extracellular Wnt receptors, triggering the canonical Wnt signaling pathway to increase expression of .get genes. In contrast to classical G-protein coupled receptors, does not activate heterotrimeric G-proteins to transduce the signal. Its function as activator of the Wnt signaling pathway is required for the development of various organs, including liver, kidney, intestine, bone, reproductive tract and eye. May also act as a receptor for norrin (NDP), such results however require additional confirmation in vivo. Required during spermatogenesis to activate the Wnt signaling pathway in peritubular myoid cells. Required for the maintenance of intestinal stem cells and Paneth cell differentiation in postnatal intestinal crypts. Acts as a regulator of bone formation and remodeling. Involved in kidney development; required for maintaining the ureteric bud in an undifferentiated state. Involved in the development of the anterior segment of the eye. Required during erythropoiesis. Also acts as a negative regulator of innate immunity by inhibiting TLR2/TLR4 associated pattern-recognition and pro-inflammatory cytokine production. Plays an important role in regulating the circadian rhythms of plasma lipids, partially through regulating the rhythmic expression of MTTP. Required for proper development of GnRH neurons (gonadotropin-releasing hormone expressing neurons) that control the release of reproductive hormones from the pitui.y gland.			
ADC	HGNC:13310	GPRC5D	Q9NZD1	ENSG00000111291	55507	1	0	0	1	0	2	1	ADCdb		G-protein coupled receptor family C group 5 member D (GPRC5D)				
ADC	HGNC:1338	C5AR1	P21730	ENSG00000197405	728	1	1	0	1	0	3	1	ADCdb		C5a anaphylatoxin chemotactic receptor 1 (C5AR1)	Receptor for the chemotactic and inflammatory peptide anaphylatoxin C5a. The ligand interacts with at least two sites on the receptor: a high- affinity site on the extracellular N-terminus, and a second site in the transmembrane region which activates downstream signaling events. Receptor activation stimulates chemotaxis, granule enzyme release, intracellular calcium release and superoxide anion production.			
ADC	HGNC:1383	CA9	Q16790	ENSG00000107159	768	1	0	1	0	0	2	1	ADCdb		Carbonic anhydrase 9 (CA9)	Catalyzes the interconversion between carbon dioxide and water and the dissociated ions of carbonic acid (i.e. bicarbonate and hydrogen ions).			
ADC	HGNC:13941	SLC44A4	Q53GD3	ENSG00000204385	80736	1	1	0	1	0	3	1	ADCdb		Choline transporter-like protein 4 (SLC44A4)	Choline transporter that plays a role in the choline- acetylcholine system and is required to the efferent innervation of hair cells in the olivocochlear bundle for the maintenance of physiological function of outer hair cells and the protection of hair cells from acoustic injury. Also described as a thiamine pyrophosphate transporter in colon, may mediate the absorption of microbiota- generated thiamine pyrophosphate and contribute to host thiamine (vitamin B1) homeostasis.			
ADC	HGNC:14558	CLEC7A	Q9BXN2	ENSG00000172243	64581	1	1	0	1	0	3	1	ADCdb		C-type lectin domain family 7 member A (CLEC7A)	Lectin that functions as pattern recognizing receptor (PRR) specific for beta-1,3-linked and beta-1,6-linked glucans, which constitute cell wall constituents from pathogenic bacteria and fungi. Necessary for the TLR2-mediated inflammatory response and activation of NF-kappa-B: upon beta-glucan binding, recruits SYK via its ITAM motif and promotes a signaling cascade that activates some CARD domain-BCL10-MALT1 (CBM) signalosomes, leading to the activation of NF-kappa-B and MAP kinase p38 (MAPK11, MAPK12, MAPK13 and/or MAPK14) pathways which stimulate expression of genes encoding pro-inflammatory cytokines and chemokines. Enhances cytokine production in macrophages and dendritic cells. Mediates production of reactive oxygen species in the cell. Mediates phagocytosis of C.albicans conidia. Binds T-cells in a way that does not involve their surface glycans and plays a role in T-cell activation. Stimulates T-cell proliferation. Induces phosphorylation of SCIMP after binding beta-glucans.			
